Date,Category,Event_Name,Metric_Impact,Strategic_Implication
Aug-2024,Financial,IPO Listing,Stock hits ₹150 peak,Capital secured for Gigafactory phase 1
Oct-2024,Regulatory,CCPA Show Cause Notice,-10000 customer complaints,Severe brand damage; MHI investigates subsidy eligibility
Jan-2025,Market Share,Share Drops Below 25%,Share drops to 24.8%,Legacy players TVS/Bajaj begin aggressive overtake
Oct-2025,Financial,Ather Overtakes Ola Revenue,Ather hits ₹899 Cr Q2,Ather proves premium pricing + reliable service wins
Jan-2026,Market Share,Share Slumps to Single Digits,Share drops to ~5.8%,Total loss of market dominance
Feb-2026,Financial,Q3 FY26 Structural Reset,Gross Margin hits 34.3%,Breakeven lowered to 15000 units/month via extreme OpEx cuts
Apr-2026,Technology,LFP 46100 Cell Announced,Cost reduction,Pivot to LFP chemistry for better thermal stability and margins
May-2026,Strategic,B2B Cell Supply Talks,Gigafactory hits 2.5 GWh,Pivoting from D2C dependency to B2B battery supplier
